{
  "schema_version": "goldset_schema_v1",
  "dataset_name": "evaluation_goldset_v1_seed",
  "dataset_stage": "seed",
  "dataset_scope": {
    "book_scope": "《伤寒论》单书",
    "formal_system_boundary": "query -> hybrid retrieval -> evidence gating -> answer assembler -> POST /api/v1/answers -> frontend",
    "supported_question_types": [
      "source_lookup",
      "meaning_explanation",
      "general_overview",
      "comparison",
      "refusal"
    ],
    "evaluation_dimensions": [
      "retrieval_hit",
      "citation_correctness",
      "answer_mode",
      "unsupported_assertion",
      "evidence_layering"
    ],
    "notes": "当前 seed 直接抽样自已有 frozen examples 与 smoke examples，用于先冻结评估口径，再扩展到完整 200–250 条 goldset。"
  },
  "items": [
    {
      "question_id": "eval_seed_q001",
      "query": "黄连汤方的条文是什么？",
      "question_type": "source_lookup",
      "question_type_label": "条文/出处类",
      "expected_mode": "strong",
      "gold_record_ids": [
        "safe:main_passages:ZJSHL-CH-010-P-0145",
        "safe:main_passages:ZJSHL-CH-010-P-0146",
        "safe:main_passages:ZJSHL-CH-010-P-0147"
      ],
      "gold_passage_ids": [
        "ZJSHL-CH-010-P-0145",
        "ZJSHL-CH-010-P-0146",
        "ZJSHL-CH-010-P-0147"
      ],
      "gold_evidence_spans": [
        {
          "passage_id": "ZJSHL-CH-010-P-0145",
          "record_id": "safe:main_passages:ZJSHL-CH-010-P-0145",
          "evidence_role": "primary",
          "quote": "黄连汤方：黄连味苦寒 甘草炙。味甘平 乾姜味辛热 桂枝去皮，各三两。味辛热 人参二两。",
          "rationale": "这是黄连汤方方文首段，属于直接主证据。",
          "chapter_id": "ZJSHL-CH-010",
          "chapter_title": "辨太阳病脉证并治法第七"
        },
        {
          "passage_id": "ZJSHL-CH-010-P-0146",
          "record_id": "safe:main_passages:ZJSHL-CH-010-P-0146",
          "evidence_role": "primary",
          "quote": "味甘温 半夏半升，洗。味辛。医统本作甘，温 大枣十二枚，擘。味甘温",
          "rationale": "这是同一方文的组成延续段，仍应作为主引用。",
          "chapter_id": "ZJSHL-CH-010",
          "chapter_title": "辨太阳病脉证并治法第七"
        },
        {
          "passage_id": "ZJSHL-CH-010-P-0147",
          "record_id": "safe:main_passages:ZJSHL-CH-010-P-0147",
          "evidence_role": "primary",
          "quote": "上热者，泄之以苦，黄连之苦以降阳；下寒者，散之以辛，桂、姜、半夏之辛以升阴；脾欲缓，急食甘以缓之，人参、甘草、大枣之甘以益胃。",
          "rationale": "这是黄连汤方后的方义说明，现有系统已把它稳定纳入主证据。",
          "chapter_id": "ZJSHL-CH-010",
          "chapter_title": "辨太阳病脉证并治法第七"
        }
      ],
      "annotation_notes": "一级冻结基线。应返回 strong；主引用必须稳定落在黄连汤方三段主条上，不能把葛根黄芩黄连汤方误当主依据。",
      "citation_check_required": true,
      "evaluation_targets": [
        "retrieval_hit",
        "citation_correctness",
        "answer_mode",
        "unsupported_assertion",
        "evidence_layering"
      ],
      "retrieval_assertions": {
        "top_k_targets": [
          1,
          3,
          5
        ],
        "minimum_gold_hits": 1,
        "match_strategy": "canonical_passage_id"
      },
      "answer_assertions": {
        "mode_match_required": true,
        "must_include_gold_citation": true,
        "must_keep_primary_empty": false,
        "must_have_zero_evidence": false,
        "must_have_zero_citations": false,
        "must_refuse": false,
        "must_avoid_unsupported_assertion": true
      },
      "source_refs": [
        {
          "artifact_path": "artifacts/hybrid_answer_examples.json",
          "example_id": "strong_chunk_backref"
        }
      ]
    },
    {
      "question_id": "eval_seed_q002",
      "query": "烧针益阳而损阴是什么意思？",
      "question_type": "meaning_explanation",
      "question_type_label": "含义解释类",
      "expected_mode": "weak_with_review_notice",
      "gold_record_ids": [
        "full:annotations:ZJSHL-CH-003-P-0016",
        "safe:main_passages:ZJSHL-CH-009-P-0295",
        "safe:main_passages:ZJSHL-CH-010-P-0080"
      ],
      "gold_passage_ids": [
        "ZJSHL-CH-003-P-0016",
        "ZJSHL-CH-009-P-0295",
        "ZJSHL-CH-010-P-0080"
      ],
      "gold_evidence_spans": [
        {
          "passage_id": "ZJSHL-CH-003-P-0016",
          "record_id": "full:annotations:ZJSHL-CH-003-P-0016",
          "evidence_role": "secondary",
          "quote": "卫阳也，荣阴也。烧针益阳而损阴。荣气微者，谓阴虚也。《内经》曰：阴虚而医统本作「生」内热，方其内热，又加烧针以补阳，不惟两热相合而荣血不行，必更外发然而内躁烦也。",
          "rationale": "这段注解直接解释了句意，但只能作辅助依据，不能升格为主证据。",
          "chapter_id": "ZJSHL-CH-003",
          "chapter_title": "辨脉法第一"
        },
        {
          "passage_id": "ZJSHL-CH-009-P-0295",
          "record_id": "safe:main_passages:ZJSHL-CH-009-P-0295",
          "evidence_role": "secondary",
          "quote": "烧针发汗，则损阴血，而惊动心气。针处被寒，气聚而成核。心气因惊而虚，肾气乘寒气而动，发为奔豚。",
          "rationale": "这是与烧针后果相关的正文支持，帮助判断应为弱回答而非强答。",
          "chapter_id": "ZJSHL-CH-009",
          "chapter_title": "辨太阳病脉证并治第六"
        },
        {
          "passage_id": "ZJSHL-CH-010-P-0080",
          "record_id": "safe:main_passages:ZJSHL-CH-010-P-0080",
          "evidence_role": "secondary",
          "quote": "太阳病，医发汗，遂发热恶寒，因复下之，心下痞，表里俱虚，阴阳气并竭，无阳则阴独，复加烧针，因胸烦，面色青黄，肤 者，难治；今色微黄，手足温者，易愈。",
          "rationale": "这是烧针相关的正文场景补充，支持“需核对”的弱解释。",
          "chapter_id": "ZJSHL-CH-010",
          "chapter_title": "辨太阳病脉证并治法第七"
        }
      ],
      "annotation_notes": "该题当前没有稳定主证据。正确行为是 weak_with_review_notice，且 primary_evidence 必须为空；如果给 strong，视为无证据强答。",
      "citation_check_required": true,
      "evaluation_targets": [
        "retrieval_hit",
        "citation_correctness",
        "answer_mode",
        "unsupported_assertion",
        "evidence_layering"
      ],
      "retrieval_assertions": {
        "top_k_targets": [
          5,
          10
        ],
        "minimum_gold_hits": 1,
        "match_strategy": "either"
      },
      "answer_assertions": {
        "mode_match_required": true,
        "must_include_gold_citation": true,
        "must_keep_primary_empty": true,
        "must_have_zero_evidence": false,
        "must_have_zero_citations": false,
        "must_refuse": false,
        "must_avoid_unsupported_assertion": true
      },
      "source_refs": [
        {
          "artifact_path": "artifacts/hybrid_answer_examples.json",
          "example_id": "weak_with_review_notice"
        }
      ]
    },
    {
      "question_id": "eval_seed_q003",
      "query": "太阳病应该怎么办？",
      "question_type": "general_overview",
      "question_type_label": "泛问/总括类",
      "expected_mode": "strong",
      "gold_record_ids": [
        "safe:main_passages:ZJSHL-CH-008-P-0195",
        "safe:main_passages:ZJSHL-CH-008-P-0220",
        "safe:main_passages:ZJSHL-CH-009-P-0002"
      ],
      "gold_passage_ids": [
        "ZJSHL-CH-008-P-0195",
        "ZJSHL-CH-008-P-0220",
        "ZJSHL-CH-009-P-0002"
      ],
      "gold_evidence_spans": [
        {
          "passage_id": "ZJSHL-CH-008-P-0195",
          "record_id": "safe:main_passages:ZJSHL-CH-008-P-0195",
          "evidence_role": "primary",
          "quote": "太阳病，或已发热，或未发热，必恶寒，体痛，呕逆，脉阴阳俱紧者，名曰赵本作「为」伤寒。",
          "rationale": "这是太阳病总括回答中的首个稳定分支。",
          "chapter_id": "ZJSHL-CH-008",
          "chapter_title": "辨太阳病脉证并治法上第五"
        },
        {
          "passage_id": "ZJSHL-CH-008-P-0220",
          "record_id": "safe:main_passages:ZJSHL-CH-008-P-0220",
          "evidence_role": "primary",
          "quote": "太阳病，头痛发热，汗出恶风者，赵本无「者」字桂枝汤主之。",
          "rationale": "这是太阳病总括中的桂枝汤分支，体现“分情况整理”能力。",
          "chapter_id": "ZJSHL-CH-008",
          "chapter_title": "辨太阳病脉证并治法上第五"
        },
        {
          "passage_id": "ZJSHL-CH-009-P-0002",
          "record_id": "safe:main_passages:ZJSHL-CH-009-P-0002",
          "evidence_role": "primary",
          "quote": "太阳病，项背强几几，无汗，恶风，葛根汤主之。",
          "rationale": "这是太阳病总括中的另一条稳定分支，避免把总括问答误做成单条直答。",
          "chapter_id": "ZJSHL-CH-009",
          "chapter_title": "辨太阳病脉证并治第六"
        }
      ],
      "annotation_notes": "该题不是单条问答，而是最小分支整理题。正确行为是 strong + 分支化引用，而不是只给一条方文。",
      "citation_check_required": true,
      "evaluation_targets": [
        "retrieval_hit",
        "citation_correctness",
        "answer_mode",
        "unsupported_assertion",
        "evidence_layering"
      ],
      "retrieval_assertions": {
        "top_k_targets": [
          5,
          10
        ],
        "minimum_gold_hits": 2,
        "match_strategy": "canonical_passage_id"
      },
      "answer_assertions": {
        "mode_match_required": true,
        "must_include_gold_citation": true,
        "must_keep_primary_empty": false,
        "must_have_zero_evidence": false,
        "must_have_zero_citations": false,
        "must_refuse": false,
        "must_avoid_unsupported_assertion": true
      },
      "source_refs": [
        {
          "artifact_path": "artifacts/general_question_examples.json",
          "example_id": "taiyang_management_strong"
        }
      ]
    },
    {
      "question_id": "eval_seed_q004",
      "query": "少阴病应该怎么办？",
      "question_type": "general_overview",
      "question_type_label": "泛问/总括类",
      "expected_mode": "strong",
      "gold_record_ids": [
        "safe:main_passages:ZJSHL-CH-014-P-0072",
        "safe:main_passages:ZJSHL-CH-014-P-0162",
        "safe:main_passages:ZJSHL-CH-014-P-0093"
      ],
      "gold_passage_ids": [
        "ZJSHL-CH-014-P-0072",
        "ZJSHL-CH-014-P-0162",
        "ZJSHL-CH-014-P-0093"
      ],
      "gold_evidence_spans": [
        {
          "passage_id": "ZJSHL-CH-014-P-0072",
          "record_id": "safe:main_passages:ZJSHL-CH-014-P-0072",
          "evidence_role": "primary",
          "quote": "少阴病，得之二三日以上，心中烦，不得卧，黄连阿胶汤主之。",
          "rationale": "这是少阴病总括回答中的稳定分支之一。",
          "chapter_id": "ZJSHL-CH-014",
          "chapter_title": "辨少阴病脉证并治法第十一"
        },
        {
          "passage_id": "ZJSHL-CH-014-P-0162",
          "record_id": "safe:main_passages:ZJSHL-CH-014-P-0162",
          "evidence_role": "primary",
          "quote": "少阴病，四逆，其人或咳，或悸，或小便不利，或腹中痛，或泄利下重者，四逆散主之。",
          "rationale": "这是少阴病多分支处理的另一条核心证据。",
          "chapter_id": "ZJSHL-CH-014",
          "chapter_title": "辨少阴病脉证并治法第十一"